{
  "schema_version": 2,
  "model": "Qwen/Qwen3-235B-A22B-Thinking-2507-FP8",
  "num_moe_layers": 1,
  "num_logical_experts": 128,
  "expert_parallel_size": 4,
  "experts_per_rank": 32,
  "experts_per_token": 8,
  "count_semantics": "logical_routed_token_assignments",
  "aggregation": {
    "scope": "all_captured_eplb_steps",
    "observed_eplb_step_min": 0,
    "observed_eplb_step_max": 0,
    "record_count": 1
  },
  "expert_partitioning": {
    "kind": "contiguous_logical_expert_ids",
    "layout": "rank_major"
  },
  "counts_by_layer": [
    [
      1912,
      929,
      1262,
      375,
      1074,
      407,
      0,
      1888,
      397,
      2249,
      588,
      1415,
      546,
      1134,
      1743,
      1495,
      613,
      600,
      395,
      1138,
      534,
      2015,
      1552,
      770,
      230,
      0,
      351,
      1868,
      597,
      330,
      1668,
      909,
      1612,
      1034,
      1264,
      1178,
      872,
      2209,
      613,
      2423,
      591,
      881,
      5,
      1931,
      1124,
      210,
      2240,
      1276,
      1189,
      1904,
      405,
      985,
      1021,
      1133,
      1198,
      2284,
      537,
      747,
      569,
      263,
      746,
      1259,
      519,
      1999,
      1479,
      1433,
      1093,
      785,
      993,
      1052,
      835,
      535,
      880,
      1737,
      1034,
      1386,
      1689,
      548,
      746,
      1095,
      1188,
      558,
      634,
      0,
      1049,
      710,
      509,
      549,
      903,
      781,
      725,
      2164,
      3,
      301,
      9,
      1361,
      1075,
      862,
      14,
      997,
      19,
      569,
      302,
      564,
      2557,
      1560,
      962,
      821,
      865,
      795,
      1279,
      733,
      828,
      788,
      1635,
      2543,
      1467,
      1413,
      1854,
      2103,
      875,
      1146,
      762,
      1326,
      1413,
      809,
      685,
      1482
    ]
  ],
  "probabilities_by_layer": [
    [
      0.01458740234375,
      0.00708770751953125,
      0.0096282958984375,
      0.00286102294921875,
      0.0081939697265625,
      0.00310516357421875,
      0.0,
      0.014404296875,
      0.00302886962890625,
      0.01715850830078125,
      0.004486083984375,
      0.01079559326171875,
      0.0041656494140625,
      0.0086517333984375,
      0.01329803466796875,
      0.01140594482421875,
      0.00467681884765625,
      0.00457763671875,
      0.00301361083984375,
      0.0086822509765625,
      0.0040740966796875,
      0.01537322998046875,
      0.0118408203125,
      0.0058746337890625,
      0.0017547607421875,
      0.0,
      0.00267791748046875,
      0.014251708984375,
      0.00455474853515625,
      0.0025177001953125,
      0.012725830078125,
      0.00693511962890625,
      0.012298583984375,
      0.0078887939453125,
      0.0096435546875,
      0.0089874267578125,
      0.00665283203125,
      0.01685333251953125,
      0.00467681884765625,
      0.01848602294921875,
      0.00450897216796875,
      0.00672149658203125,
      3.814697265625e-05,
      0.01473236083984375,
      0.008575439453125,
      0.0016021728515625,
      0.01708984375,
      0.009735107421875,
      0.00907135009765625,
      0.0145263671875,
      0.00308990478515625,
      0.00751495361328125,
      0.00778961181640625,
      0.00864410400390625,
      0.0091400146484375,
      0.017425537109375,
      0.00409698486328125,
      0.00569915771484375,
      0.00434112548828125,
      0.00200653076171875,
      0.0056915283203125,
      0.00960540771484375,
      0.00395965576171875,
      0.01525115966796875,
      0.01128387451171875,
      0.01093292236328125,
      0.00833892822265625,
      0.00598907470703125,
      0.00757598876953125,
      0.008026123046875,
      0.00637054443359375,
      0.00408172607421875,
      0.0067138671875,
      0.01325225830078125,
      0.0078887939453125,
      0.0105743408203125,
      0.01288604736328125,
      0.004180908203125,
      0.0056915283203125,
      0.00835418701171875,
      0.009063720703125,
      0.0042572021484375,
      0.0048370361328125,
      0.0,
      0.00800323486328125,
      0.0054168701171875,
      0.00388336181640625,
      0.00418853759765625,
      0.00688934326171875,
      0.00595855712890625,
      0.00553131103515625,
      0.016510009765625,
      2.288818359375e-05,
      0.00229644775390625,
      6.866455078125e-05,
      0.01038360595703125,
      0.00820159912109375,
      0.0065765380859375,
      0.0001068115234375,
      0.00760650634765625,
      0.00014495849609375,
      0.00434112548828125,
      0.0023040771484375,
      0.004302978515625,
      0.01950836181640625,
      0.01190185546875,
      0.0073394775390625,
      0.00626373291015625,
      0.00659942626953125,
      0.00606536865234375,
      0.00975799560546875,
      0.00559234619140625,
      0.006317138671875,
      0.006011962890625,
      0.01247406005859375,
      0.01940155029296875,
      0.01119232177734375,
      0.01078033447265625,
      0.0141448974609375,
      0.01604461669921875,
      0.00667572021484375,
      0.0087432861328125,
      0.0058135986328125,
      0.0101165771484375,
      0.01078033447265625,
      0.00617218017578125,
      0.00522613525390625,
      0.0113067626953125
    ]
  ],
  "counts_all_layers": [
    1912,
    929,
    1262,
    375,
    1074,
    407,
    0,
    1888,
    397,
    2249,
    588,
    1415,
    546,
    1134,
    1743,
    1495,
    613,
    600,
    395,
    1138,
    534,
    2015,
    1552,
    770,
    230,
    0,
    351,
    1868,
    597,
    330,
    1668,
    909,
    1612,
    1034,
    1264,
    1178,
    872,
    2209,
    613,
    2423,
    591,
    881,
    5,
    1931,
    1124,
    210,
    2240,
    1276,
    1189,
    1904,
    405,
    985,
    1021,
    1133,
    1198,
    2284,
    537,
    747,
    569,
    263,
    746,
    1259,
    519,
    1999,
    1479,
    1433,
    1093,
    785,
    993,
    1052,
    835,
    535,
    880,
    1737,
    1034,
    1386,
    1689,
    548,
    746,
    1095,
    1188,
    558,
    634,
    0,
    1049,
    710,
    509,
    549,
    903,
    781,
    725,
    2164,
    3,
    301,
    9,
    1361,
    1075,
    862,
    14,
    997,
    19,
    569,
    302,
    564,
    2557,
    1560,
    962,
    821,
    865,
    795,
    1279,
    733,
    828,
    788,
    1635,
    2543,
    1467,
    1413,
    1854,
    2103,
    875,
    1146,
    762,
    1326,
    1413,
    809,
    685,
    1482
  ],
  "probabilities_all_layers": [
    0.01458740234375,
    0.00708770751953125,
    0.0096282958984375,
    0.00286102294921875,
    0.0081939697265625,
    0.00310516357421875,
    0.0,
    0.014404296875,
    0.00302886962890625,
    0.01715850830078125,
    0.004486083984375,
    0.01079559326171875,
    0.0041656494140625,
    0.0086517333984375,
    0.01329803466796875,
    0.01140594482421875,
    0.00467681884765625,
    0.00457763671875,
    0.00301361083984375,
    0.0086822509765625,
    0.0040740966796875,
    0.01537322998046875,
    0.0118408203125,
    0.0058746337890625,
    0.0017547607421875,
    0.0,
    0.00267791748046875,
    0.014251708984375,
    0.00455474853515625,
    0.0025177001953125,
    0.012725830078125,
    0.00693511962890625,
    0.012298583984375,
    0.0078887939453125,
    0.0096435546875,
    0.0089874267578125,
    0.00665283203125,
    0.01685333251953125,
    0.00467681884765625,
    0.01848602294921875,
    0.00450897216796875,
    0.00672149658203125,
    3.814697265625e-05,
    0.01473236083984375,
    0.008575439453125,
    0.0016021728515625,
    0.01708984375,
    0.009735107421875,
    0.00907135009765625,
    0.0145263671875,
    0.00308990478515625,
    0.00751495361328125,
    0.00778961181640625,
    0.00864410400390625,
    0.0091400146484375,
    0.017425537109375,
    0.00409698486328125,
    0.00569915771484375,
    0.00434112548828125,
    0.00200653076171875,
    0.0056915283203125,
    0.00960540771484375,
    0.00395965576171875,
    0.01525115966796875,
    0.01128387451171875,
    0.01093292236328125,
    0.00833892822265625,
    0.00598907470703125,
    0.00757598876953125,
    0.008026123046875,
    0.00637054443359375,
    0.00408172607421875,
    0.0067138671875,
    0.01325225830078125,
    0.0078887939453125,
    0.0105743408203125,
    0.01288604736328125,
    0.004180908203125,
    0.0056915283203125,
    0.00835418701171875,
    0.009063720703125,
    0.0042572021484375,
    0.0048370361328125,
    0.0,
    0.00800323486328125,
    0.0054168701171875,
    0.00388336181640625,
    0.00418853759765625,
    0.00688934326171875,
    0.00595855712890625,
    0.00553131103515625,
    0.016510009765625,
    2.288818359375e-05,
    0.00229644775390625,
    6.866455078125e-05,
    0.01038360595703125,
    0.00820159912109375,
    0.0065765380859375,
    0.0001068115234375,
    0.00760650634765625,
    0.00014495849609375,
    0.00434112548828125,
    0.0023040771484375,
    0.004302978515625,
    0.01950836181640625,
    0.01190185546875,
    0.0073394775390625,
    0.00626373291015625,
    0.00659942626953125,
    0.00606536865234375,
    0.00975799560546875,
    0.00559234619140625,
    0.006317138671875,
    0.006011962890625,
    0.01247406005859375,
    0.01940155029296875,
    0.01119232177734375,
    0.01078033447265625,
    0.0141448974609375,
    0.01604461669921875,
    0.00667572021484375,
    0.0087432861328125,
    0.0058135986328125,
    0.0101165771484375,
    0.01078033447265625,
    0.00617218017578125,
    0.00522613525390625,
    0.0113067626953125
  ]
}